doc_id;full_text;topic;label
MarcBernhardAfD15989665871;Spahns spaetes Eingestaendnis: Totaler Shutdown war ueberzogen! Einsicht zu spaet, Auswirkungen der Zwangseingriffe auf Wirtschaft verheerend! Bereits im April veroeffentlichte Af D-Bundestagsfraktion Corona-Positionspapier zur schrittweisen Rueckkehr zur Normalitaet! Bernhard;Shutdown;negative
MarcHenrichmann15732296421;Zuegig und effektiv! Sehr gute Arbeit des BamF. Es bleibt die berechtigte Frage, ob das Asylrecht nicht grundsaetzlich verwirkt, wer den Rechtsstaat bekaempft und schwerste Straftaten begeht. bamf miri akzeptanz asyl;BamF;positive
MarcHenrichmann16079307801;Sprengstoff in die Haende von Betrunkenen geben????? Gehts noch dicker???? Womit wenigstens jetzt geklaert sein duerfte, dass es der Umwelthilfe dabei nie wirklich um die Umwelt ging. Verbot Feuerwerk Silvester Familie Kinder;Umwelthilfe;negative
Marc_Jongen16039766051;Sie wird es nicht lassen, bis die deutsche Wirtschaft nicht voellig zerstoert ist. Dieser Lockdown2 wird abraeumen, was lockdown 1 uebrig gelassen hat. Wozu brauchen wir noch Demokratie, wenn Merkels coroniertes Haupt so weise fuer uns lenkt und waltet? AfD;lockdown;negative
MargareteBause15453068091;Endlich eine gute Nachricht aus Aegypten! Kairoer Strafgericht hat die Freilassung von amalfathy angeordnet. Der Einsatz hat sich gelohnt. Danke Egypt to bail Amal Fathy, jailed for fake news after harassment complaint;amalfathy;positive
MargareteBause15477106211;Kluge, engagierte, beruehrende Rede von Rita Suessmuth in der heutigen Feierstunde im Bundestag zu 100 Jahre Frauenwahlrecht: Fuer mich ist heute ein Menschenrechtstag. So ist es!;Frauenwahlrecht;positive
MargareteBause15567070221;Waffenlieferungen nach Saudi-Arabien sind taetige Beihilfe zu Kriegsverbrechen. Das scheinheilige Verhalten der GroKo traegt zur Erosion des Voelkerrecht s bei. Lesenswerter Kommentar von Kriegsverbrechen - Die Macht triumphiert ueber das Recht;Waffenlieferungen;negative
MargareteBause15737650681;Wir haben die Bundesregierung zum Sozialkreditsystem in China gefragt. Die Antworten zeugen von erschreckendem Unwissen und fahrlaessiger Gleichgueltigkeit. Anfrage der Gruenen: Bundesregierung ist bei China erstaunlich ahnungslos via;China;negative
MargareteBause15961948791;Mit atemberaubender Geschwindigkeit werden in Hong Kong die demokratischen Grundrechte ausser Kraft gesetzt. In einem Jahr werden die meisten Demokratieverteidiger*innen im Gefaengnis sitzen. Wo bleibt die schnelle und klare Verurteilung durch BReg und EU? Hong Kong Matters;Hong;negative
MariaKlSchmeink15884903771;Genau das darf nicht passieren. Diese Passage im geplanten GEBT duerfen und nicht zulassen. Das ist eine Einladung zu Diskriminierung und Entsolidarisierung. Immunitaetsausweis;GEBT;negative
MariaKlSchmeink15925393021;Das ist ein grossartige Unterstuetzung fuer die vielen Bemuehungen. Ein europaeischer Verbund fuer Forschung koennte auch helfen endlich eine wirksame Arzneimitteltherapie Medikament zu entwickeln, die die Erkrankung heilt. chronische Erschoepfungssyndrom;Erschoepfungssyndrom;positive
MariaKlSchmeink15931463411;Wer noch Argumente gegen das System der Werkvertraege mit Subunternehmen braucht: diese Unternehmen kooperieren nicht oder nur in schleppenden Schritten bei der Corona Infektionsnachverfolgung. Mafioese, ausbeuterische Strukturen, die nicht weiter zu gelassen werden duerfen Toennies;Subunternehmen;negative
MariaKlSchmeink16058655371;Einschuechterung, Veraechtlichmachung, Respektlosigkeit und Gesundheitsgefaehrdung anderer - das lassen den AfD- Abgeordneten nicht durchgehen! Die demokratischen Fraktionen stehen zusammen und lassen geschichtsvergessene Vergleiche nicht zu. parlament Bundestag;AfD;negative
MariaKlSchmeink16060666371;Bin etwas sprachlos. Der Pflegebeauftragte will eine Handreichung zum Umgang mit Corona in den Pflegeeinrichtungen im Dezember vorlegen. Ich sag mL: krasser Fall von schlechtem Zeitmanagement.;Pflegebeauftragte;negative
MariaKlSchmeink16099603241;Wir brauchen ohne Zweifel weitere Kontaktbeschraenkungen. Aber nicht solche hilflosen und realitaetsfernen Regelungen. Bringen zudem auch nichts Wesentliches zur Pandemiebekaempfung. Dagegen wuerde das Recht auf Home Office viele unnoetige Fahrten und Kontakten vermeiden.;Kontaktbeschraenkungen;negative
MarkHauptmann15693977501;Es wird voellig verrueckt: Praesident d Iran beschuldigt Israel der Unterstuetzung von ISIS. Dabei steckt der Iran hinter juengsten Anschlaegen auf Saudi Arabien hinter Terrorfinanzierung von Hisbollah, ISIS, Huthi-Rebellen. Bitte aufwachen.;Iran;negative
MarkHauptmann16013914711;Beschaemend wie SPD Gruene sich der SED/PDS/Linke anbiedern. Die DDR war ein Unrechtsstaat, weil Sie die eigenen Menschen ohne unabhaengige Justiz bespitzelt, eingesperrt erschossen hat. Als stehen wir an der Seite der Opfer.;DDR;negative
Martin_Hess_AfD15121530031;Auch die kriminellen Clans kamen einst als Fluechtlinge nach Deutschland. Heute beherrschen sie nicht nur Prostitution, Drogenhandel und Gluecksspiel. Sie unterwandern auch die oeffentlichen Institutionen. Wir muessen jetzt gegensteuern, sonst ist es zu spaet!;Fluechtlinge;negative
Martin_Hess_AfD15129039581;Die Polizei leistet hervorragende Arbeit, wenn die Politik sich hinter sie stellt und klare Vorgaben macht, anstatt ihr staendig zu misstrauen und ihren Aktionsradius einzuschraenken. Breitscheidplatz Anis Amri;Polizei;positive
Martin_Hess_AfD15192998051;Af Dim Bundestag hat heute einen Antrag auf Verbot der Vollverschleierung im oeffentlichen Raum gestellt. Vollverschleierung ist kein Glaubensinhalt und keine Form der Religionsausuebung. Sie ist Ausdruck einer Unterdrueckung der Frau und muss verboten werden!;Vollverschleierung;negative
Martin_Hess_AfD15209285981;Unfassbares Urteil, das mit Rechtsstaatlichkeit wenig zu tun hat: VW darf Autobauer nicht kuendigen, der Arbeitskollegen zu ermorden drohte und zum IS reisen wollte. Selbstverstaendlich darf VW Leben Gesundheit seiner Mitarbeiter vor Terroristen schuetzen!;Terroristen;negative
Martin_Hess_AfD15231064881;Dieses Staatsversagen muss ein Ende haben. Und die einzigen Massnahmen, mit denen sich die Sicherheitslage effektiv verbessern liesse, hat die AfD vorgeschlagen: Auslaendische Gefaehrder sind sofort und ausnahmslos abzuschieben!;Auslaendische;negative
Martin_Hess_AfD15242129581;Neuer Skandal beim BAMF. Aussenstellenleiterin soll unberechtigte Asylantraege positiv beschieden haben. Antragsteller eigens in Bussen herangekarrt. Af Dim Bundestag wird dafuer sorgen, dass ueber Korruption bei vollumfaenglich aufgeklaert wird!;Asylantraege;negative
Martin_Hess_AfD15265776911;Mit dem EU-Tuerkei-Deal haben wir einen grossen Teil unserer Sicherheit und Wohlstands in die Haende eines unberechenbaren Autokraten gelegt. Wir muessen die Souveraenitaet zurueckgewinnen und die Grenzsicherung wieder in die eigenen Haende nehmen! Erdogan AfD;Erdogan;negative
Martin_Hess_AfD15277547121;Mio-Ueberweisungen u.a. an Kanzleien unter BAMF-Aussenstellenleiterin, die mit Anwaelten bandenmaessig Asylbetrug begangen haben soll. Und die Frau ist noch frei und praesentiert sich als Gutmensch. Staatsanwaltschaft muss hier handeln und Haftgruende pruefen.;Asylbetrug;negative
Martin_Hess_AfD15278656101;Grenzoeffnung hat ungeahnte Moeglichkeiten fuer Betrueger und Gesinnungstaeter eroeffnet. Wer daran in leitender Position teilhatte, traegt Mitverantwortung und kann sich nicht herausreden. Wer welche Schuld hat, muss Untersuchungsausschuss ans Licht bringen!;Grenzoeffnung;negative
Martin_Hess_AfD15302758761;Man staunt, was die Berliner Polizeifuehrung als Polizei 3.0 bezeichnet. Die Sicherheitslage ist desolat. Polizisten muessen geistig, koerperlich charakterlich topfit sein, um die Buerger effektiv schuetzen zu koennen. Schluss mit dem Sparen am falschen Ende!;Polizeifuehrung;negative
Martin_Hess_AfD15307858871;2017 wurden 290.000 Straftaten erfasst, die Zuwanderer nur wegen der Grenzoeffnung begehen konnten. Islamistische Terrorgefahr ist hoch wie nie. Die Politik der Gro Ko hat Deutschland unsicherer gemacht. Aber die Af Dim Bundestag ist fest entschlossen, die Lage zu verbessern AfD;Zuwanderer;negative
Martin_Hess_AfD15344829291;Vor den Augen der zehnjaehrigen Tochter. Auch fuer diesen bestialischen Mord tragen Merkel und alle, die fuer Open Borders sind, die Verantwortung. Schluss damit! Fuer unsere Sicherheit: Effektiver Grenzschutz und Abschiebung bei illegalem Aufenthalt.;Abschiebung;negative
Martin_Hess_AfD15346998381;Die SPD ist UNWAe HLBAR! Geht es bei dem Heimatbegriff also vorrangig um Ausgrenzung? Ja, das kann man so sagen. Denn Heimat bezeichnet bloss die Rueckbesinnung auf ein Deutschland, das es so nie gegeben hat. Deutschland ist unsere Heimat! Deshalb AfD;SPD;negative
Martin_Hess_AfD15367606251;Gruene Extremisten halten Hambacher Forst besetzt, attackieren Polizei und legen wie Vietcong Tunnelsysteme an. Politische Unterstuetzung erhalten sie von den Gruenen. Schluss mit dieser Doppelmoral, auch Gruene muessen staatliches Gewaltmonopol respektieren!;Gruene;negative
Martin_Hess_AfD15399255521;Auch der Geiselnehmer von Koeln haette nicht mehr in Deutschland sein duerfen. BAMF hatte seine Rueckueberstellung nach Tschechien versaeumt. Das in Deutschland praktizierte Asylsystem hat zu Toten gefuehrt und verschlechtert die Sicherheitslage immer weiter.;Asylsystem;negative
Martin_Hess_AfD15401202231;Diese Regierung gefaehrdet massiv die Zukunft unseres Landes. Steigende Gewalt Terrorismus und erhebliche soziale Spannungen werden das Ergebnis dieser Politik sein. Wer seinen Kindern ein lebenswertes Land hinterlassen will, hat nur eine Wahl: AfD;Regierung;negative
Martin_Hess_AfD15434811281;Dieser Vorfall zeigt: DITIB kann kein Kooperationspartner sein. Wer Deradikalisierung und Extremismus-Praevention mit Radikalen und Extremisten betreibt, wird das Gegenteil erreichen. Islamismus darf nicht zu Deutschland gehoeren! Af Dim Bundestag AfD;DITIB;negative
Martin_Hess_AfD15468573401;Es ist nicht hinnehmbar, wie die Berliner Polizei unter Rot-Rot-Gruen zu Grunde gerichtet wird. Nur wer geistig und koerperlich die Anforderungen des Polizeiberufs erfuellt und vor allem charakterlich dafuer geeignet ist, darf Polizeibeamter werden!;Polizei;negative
Martin_Hess_AfD15492673831;So kann es nicht weitergehen. Recht muss Recht bleiben und auch fuer Migranten gelten. Wer sich illegal hier aufhaelt, ist konsequent abzuschieben. Wenn die Laender ihre Pflicht nicht umsetzen, muss der Bund diese Aufgabe wahrnehmen! Abschiebungen AfD;Migranten;negative
Martin_Hess_AfD15518793441;Es darf nicht sein, dass linke Aktivisten als Aktionskuenstler getarnt unterm Deckmantel der Kunstfreiheit unbescholtenen Buergern massiven Schaden zufuegen in ihrer Meinungsfreiheit behindern. Vor allem duerfen Behoeren wie solche Aktivisten nicht hofieren! Af Dim Bundestag;linke;negative
Martin_Hess_AfD15579293351;Aeusserst besorgniserregend: In 2 Jahren begehen Angehoerige von 104 Clans 14.225 Straftaten. spricht von Mafia-Strukturen und Parallelwelten. Das Schlimme: 36 der Tatverdaechtigen mit Clan-Hintergrund haben bereits die deutsche Staatsangehoerigkeit.;Clans;negative
Martin_Hess_AfD15619650001;Kapitulation des Rechtsstaats vor Zuwanderergewalt: Um zu deeskalieren, nimmt Polizei nicht einmal Personalien der Stoerer auf. Deeskalation geht aber nie vor Strafverfolgung. Gewalttaeter sind zu identifizieren und Strafverfahren zuzufuehren! Rheinbad;Zuwanderergewalt;negative
Martin_Hess_AfD15678404671;In Leipzig kapituliert der Rechtsstaat vor linker Gewalt. Einsatzleitung laesst Linksextremisten ein Einsatzfahrzeug kontrollieren, um zu zeigen, dass die Abschiebung nicht vollstreckt wird. Und die CDU nennt diese Unterwuerfigkeit auch noch souveraen.;Linksextremisten;negative
Martin_Hess_AfD15687286311;Diese Veraenderung laesst sich durch Einbuergerung nicht auffangen und wird irreversibel sein. Wenn wir Wohlstand und Sicherheit, in denen wir aufgewachsen sind, an unsere Kinder Enkel weitergeben wollen, muessen wir die illegale Massenmigration stoppen! Af Dim Bundestag AfD (2/2);Massenmigration;negative
Martin_Hess_AfD15687904051;Staendig war zu lesen, der Bremer BAMF-Skandal sei aufgebauscht. 1000facher Asylbetrug ist fuer viele Journalisten Kavaliersdelikt. Kein Wunder, gibt Bundesregierung doch Gelegenheit zu 100.000fachem. Schluss mit der Herrschaft des Unrechts, nur noch AfD!;Asylbetrug;negative
Martin_Hess_AfD15693967361;Gestern hat Seehofer das Bundeslagebild zur Organisierten Kriminalitaet vorgestellt. Zahlen zeigen: Clankriminalitaet im Bereich OK die Sicherheitsbedrohung Nr. 1. Auswirkungen auf Alltag der Buerger massiv. Schluss mit diesen inakzeptablen Zustaenden! AfD https://t.co/vGMNIAIosv;Clankriminalitaet;negative
Martin_Hess_AfD15695181941;Rackete bringt wohl Vergewaltiger, Folterer und Moerder nach Deutschland. Sie weiss ja auch nicht, wen sie aufnimmt. Ebenso wenig Seehofer, wer durch neues Umverteilungsabkommen zu uns kommt. Schluss mit dem migrations- und sicherheitspolitischen Amoklauf!;Umverteilungsabkommen;negative
Martin_Hess_AfD15699308231;Schleierfahndung bringt nichts, solange illegale Einwanderer nicht zurueckgewiesen werden. Seehofer betreibt Augenwischerei. Schluss damit, wir muessen die Grenzen effektiv kontrollieren und Personen ohne Einreiselegitimation konsequent zurueckweisen! AfD;Einwanderer;negative
Martin_Hess_AfD15701748521;Wir muessen aus diesem Mordanschlag Lehren ziehen und hoechste Sensibilitaet entwickeln fuer Unterwanderung Manipulation von Mitarbeitern unserer Sicherheitsbehoerden. Wir brauchen effektives Fruehwarnsystem fuer Islamisten und Clankriminelle! Paris Knife Attack;Islamisten;negative
Martin_Hess_AfD15706419151;Angreifer von Halle hatte Synagoge zum Ziel. Dieser antisemitische Amoklauf muss restlos aufgeklaert mit voller Haerte des Gesetzes bestraft werden. Antisemitismus entschlossen bekaempfen egal ob er von Islamisten, Links- oder Rechtsextremisten ausgeht!;Antisemitismus;negative
Martin_Hess_AfD15710594251;So manipuliert oeffentliche Meinung: MdB darf als gewoehnliche Kundin auf Saechsisch fordern, dass Biomaerkte keine Af D-Hirse mehr kaufen. Tiefer kann ein oeffentlich-rechtlicher Sender nicht mehr sinken. Schluss mit den Rundfunkgebuehren!;oeffentlich-rechtlicher;negative
Martin_Hess_AfD15729352171;Schon zu lange dulden und foerdern SPD Co. gewaltbereite Linksextremisten. Deshalb soll sich OB Jung Krokodilstraenen sparen und gg. linke Gewalt mit Nulltoleranz vorgehen. Kein Demokrat darf zulassen, dass Frauen von Ueberfallkommandos heimgesucht werden!;Linksextremisten;negative
Martin_Hess_AfD15833336031;CDU-Spitze wuerdigt Demokratie in Thueringen zur Schmierenkomoedie herab. Zuerst laesst Kanzlerin Merkel die MP-Wahl rueckgaengig machen, weil ein Liberaler mit Hilfe von Konservativen gewaehlt wurde. Dann muessen sich CDU-Abgeordnete enthalten, damit... (1/2);Thueringen;negative
Martin_Hess_AfD15858480321;Loebliche Eigeninitiative der Polizisten in Ludwigsburg, die das hohe Engagement der Kollegen zeigt. Jetzt muss die Polizei landesweit die erforderliche Schutzausruestung erhalten. Solche Engpaesse duerfen, egal in welcher Notlage, nicht mehr auftreten!;Polizisten;positive
Martin_Hess_AfD15926731691;UNO macht sich mit den gewalttaetigen Linksextremisten von der Antifa gemein. Gewalt durch Antidemokraten, die sich ueber demokratische Entscheidungen der Buerger hinwegsetzen, ist nicht durch Meinungs- und Versammlungsfreiheit geschuetzt, sondern muss verboten und geaechtet werden!;Antifa;negative
Martin_Hess_AfD16013097531;Deutsche NGO-Aktivisten betaetigen sich als Schlepper befeuern so illegale Migration. Behoerden gehen konsequent gg. solche Kriminelle vor. Behoerden muessen es ihnen gleichtun, um illegale Migration zu stoppen Menschenschmugglern das Handwerk legen!;Migration;negative
Martin_Hess_AfD16034389571;Behoerden haben syrischen Gefaehrder nicht lueckenlos observiert. Dieser schwere Fehler ist aufzuarbeiten. Klar ist aber: Beobachtung ist kein geeignetes Mittel, Gefaehrder unschaedlich zu machen. Selbst beobachtete Gefaehrder lassen sich nicht bei Ausfuehrung ihrer Anschlaege stoppen.;Gefaehrder;negative
Martin_Hess_AfD16043905521;Diese Woche fordere ich im Bundestag, dass alle islamistischen Gefaehrder, die nicht abgeschoben werden koennen, in Gewahrsam genommen werden, bis sie keine Gefahr mehr fuer das Leben unserer Familien darstellen. Anders ist die Bevoelkerung nicht effektiv zu schuetzen. Af Dim Bundestag;Gefaehrder;negative
Martin_Hess_AfD16050211761;Wer Imame bittet, gegen Extremisten zu kaempfen, demonstriert, dass ihm selbst zum Kampf gegen Islamismus die noetige Entschlossenheit fehlt. Ein Innenminister bittet nicht, ein Innenminister entscheidet. Moscheen der Extremisten schliessen und Islamisten abschieben! Islamkonferenz;Islamisten;negative
Martin_Hess_AfD16082181921;Vorbestrafter Syrer vergewaltigt Maedchen in Ansbach. Und Gruene wie sind trotz all der Gewalttaten bis hin zu Terrorattacken fuer Verlaengerung des Abschiebestopps nach Syrien. Solche Feinde der Inneren Sicherheit gehoeren konsequent abgewaehlt!;Abschiebestopps;negative
MatthiasGastel15167822221;Die CO2-Emissionen von Deutschland steigen weiter, vor allem im Verkehr. Die neue Gro Ko beginnt dort, wo die alte aufgehoert hat: Klimapolitisches Nichtstun. Wird Zeit, dass Union und SPD endlich ueber Klimaschutz und moderne Mobilitaet verhandeln!;Klimaschutz;negative
MatthiasGastel15179976591;Gro Ko bremst weiter bei Verkehrswende: Dringend notwendige Massnahmen wie der Abbau der Dieselsubvention, die blaueplakette und eine verursachergerechte Infrastruktur-Finanzierung werden aus Feigheit nicht angepackt. So wird der Klimaschutz verraten!;Klimaschutz;negative
MatthiasGastel15232499831;Im Gueterverkehr gewinnt Lkw weiter und Bahn verliert. Das ist auch das traurige Ergebnis verfehlter Verkehrspolitik! Trassenpreise wurden erhoeht, Lkw-Maut reduziert. Brauchen jetzt Umsteuern: Trassenpreise runter, digitale Chancen nutzen, Engpaesse im Schienennetz beheben!;Verkehrspolitik;negative
MatthiasHauer15918113361;Ganz schwache Reaktion von Ruhr-West auf die unsaeglichen Aeusserungen von Ursula Gerster in Essen. Eine klare Distanzierung sieht anders aus. Polizei verdi GDP DPol G;Polizei;negative
MatthiasHauer15987812231;Mutige Polizistinnen + Polizisten haben gestern das Reichstagsgebaeude verteidigt. Alle Demokraten sollten sich diese Menschen zum Vorbild nehmen. Unsere Demokratie muessen wir gegen Extremisten gemeinsam verteidigen. b2908 be2908 Sturmauf Berlin Sturm Auf Den Reichstag Nazis Raus;Polizisten;positive
MatthiasHauer16037303551;Nicht das Establishment verhindert, dass Vorsitzender wird, sondern er selbst - u.a. durch solche Angriffe auf Parteifreunde. Merz hat bewusst Mitarbeit in CDU-Fuehrung verweigert - waehrend und gestalten, motzt er vom Spielfeldrand.;Merz;negative
MdB_Lucassen15828880111;EU hat sich mit dem Fluechtlingsdeal unnoetig erpressbar gemacht. Unsere Grenzen muessen von uns selbst geschuetzt werden. Die tuerkischen Operationen in Syrien dienen nicht der Verteidigung und koennen nicht den Buendnisfall der NATO ausloesen. BReg muss das deutlich kommunizieren.;Fluechtlingsdeal;negative
MdB_Lucassen16003215061;2. Ein neuer Migrationspakt fuer illegale Masseneinwanderung nach Deutschland. Das Beispiel Moria zeigt, dass kein anderes europaeisches Land diesen Weg mitgeht. Die Folge: Ein deutscher Sonderweg der fatalen Fluechtlingspolitik.;Migrationspakt;negative
MdB_Mueller_AfD15575723261;SPD moechte Sozialkassen pluendern zur Sicherung der Grundrente.Milliarden Graeber,angefangen von A wie Zerstoerung der Automobilindustr. ueber B wie BER- 7,2 Milliarden beerdigt zu P Pluenderung der KV- und ALVers. fuer total verarmten Rentner, zu Z wie Zug faehrt immer Wand.;Grundrente;negative
MetinHakverdi15736454411;Applepay I/II: Zukunft gerecht gestalten: Heute habe wir einen grossen (riesigen) Schritt in Richtung gerechter Plattform-Oekonomie gemacht. Apple muss in Zukunft auf den I-Phones die Bezahlung durch andere Zahlungsdienstleistern ermoeglichen.;Plattform-Oekonomie;positive
MiRo_SPD15821875131;Das Milieu von Taten wie in Hanau wird ideologisch genaehrt von Faschisten wie Hoecke.Demokratieverachtung, Rassismus, Antisemitismus, Antiziganismus Islamfeindlichkeit fallen auf fruchtbaren Boden. Deshalb bleibe ich dabei: die AfD ist der politische Arm des Rechtsterrorismus!;AfD;negative
MiRo_SPD16023183451;Die Corona-Pandemie hat Minderheiten besonders schwer getroffen. Auch in Mittelamerika leiden LGBTI unter anhaltender Gewalt+Diskriminierung. Das ist voellig inakzeptabel, LGBTI-Rechte sind Menschenrechte, immer und ueberall!https://t.co/x847xo3q2U;LGBTI;negative
MichaelLeutert15211369791;Warum der AfD-Antrag auf ersatzlose Abschaffung des Solidaritaetszuschlags finanz- und verteilungspolitischer Unsinn ist. Die AfD moechte Einkommensstarke entlasten und Ausgaben, die der Allgemeinheit zugute kommen, kuerzen. Ein Antrag fuer die Tonne!;Solidaritaetszuschlag;negative
MichaelLeutert15406548871;Das AJZ leistet Grossartiges in der Jugendsozialarbeit und traegt zur Stadtentwicklung bei. Es praegt mit die alternative Kulturszene in der Stadt und ist ein offener Ort zur Diskussion um Politik und Gesellschaft. Solidaritaet mit dem AJZ Chemnitz !;AJZ;positive
NicoleGohlke15693105421;Ja, genau, die Gro Ko steht fuer Augen Zu Und Durch, ist Wirtschaftslobby und versagt beim Kampf gegen Armut Mietenwahnsinn Klimakrise. Wenn das mehr Leute in der SPD erkennen wuerden, ist ein erster Schritt gemacht. Kein Weiter So mit diesem Klimapaket;Gro;negative
NicoleGohlke15700214391;Die Soziale Spaltung in diesem Land laesst den Atem stocken. Das reichste Zehntel besitzt 56 Prozent des Vermoegens profitiert von Immobilien-Boom. Und die Gro Ko verhindert weiterhin Millionaersteuer. Wie kann man da eigentlich in den Spiegel schauen?;Millionaersteuer;negative
NicoleGohlke15706117931;Bundesregierung macht ihrem Ruf als Wirtschaftslobby wirklich alle Ehre. Das Klimapaket ist ein Placebo fuer Umwelt eine Belastung fuer alle mit Niedriglohn und geringer Rente. Wer die Menschen mitnehmen will, darf die Armen nicht noch aermer machen!;Klimapaket;negative
NicoleGohlke15713010641;Die Internierung von Gefluechteten in voellig ueberfuellten Lagern in Griechenland und illegale Pushbacks in die Tuerkei muessen aufhoeren. Das sind allesamt Verletzungen von Asylrecht und Menschenrechte|n. Samos Lesbos;Asylrecht;negative
NicoleGohlke15714629751;Es ist unwuerdig, wie sich die Bundesregierung fuer NATO Ruestungsexporte Fluechtlingsdeal zum Handlanger des Erdogan-Regimes macht die Kurden in Deutschland ihrer Grundrechte beraubt. Aber Stop Erdogan -Demo in Koeln findet statt! riseup4rojava;Erdogan;negative
NicoleGohlke15850351561;Nun raecht sich, dass Spahn und die CSU den Pflegenotstand und die Niedrigloehne ueber Jahre haben laufen lassen. Wer neoliberale Pflege- und Gesundheitspolitik betreibt, gefaehrdet wissentlich Kranke und Aeltere, nicht nur zu Zeiten der Coronakrise.;Pflegenotstand;negative
NicoleGohlke15929815411;Fast 600 Mrd. horten Deutsche auf sechs Mio Konten in Auslands-Steueroasen. Trotz Meldesystem bestehen Steuerschlupfloecher weiter, wegen zu wenig Personal. Superreiche schaden dem Gemeinwohl BReg handelt im Schneckentempo. Unsozial;Steuerschlupfloecher;negative
NicoleGohlke15946243551;Die Polizei hat ein Rechtsterror-Problem in den eigenen Reihen. Wenn Neonazi-Polizisten wiederholt Menschen mit dem Tode bedrohen koennen, ist das kein Kavaliersdelikt, sondern Staatsversagen. Und noch immer fehlen unabhaengige Kontrollgremien.;Polizei;negative
NordMdb15880588111;Nicht weil er anders handelt sondern, weil er sich so benimmt, wie er sich benimmt. Ein konsistentes Handeln von Trump ist ja gerade nicht vorhanden. Der hierzulande gegenwaertig wahrnehmbare intellektuelle Zusammenbruch des Bildungsbuergertums ist wahrlich erschreckend.;Trump;negative
Oliver_Krischer15325385241;Vor einen Jahr gab es beim Dieselgipfel vollmundige Zusagen. Umgesetzt ist bis heute - NICHTS. Deutlicher kann eine Bundesregierung nicht dokumentieren, dass ihr die Gesundheit von Menschen und Rechte Millionen betrogener Diesel Besitzer egal sind;Dieselgipfel;negative
Oliver_Krischer15334939221;Jahrelang betruegen, dann mit Dobrindt Co. die Einfuehrung von realistischeren Abgastest verhindern und jetzt deswegen anderen die Schuld in die Schuhe schieben, wenn sie 2018 keine Elektroauto|s mehr liefern koennen. So dreist koennen nur VW Manager sein;VW;negative
Oliver_Krischer15806443491;Wie kaputt und verzweifelt muss eigentlich eine Partei sein, die seit Jahren den Verkehrsminister stellt, die aber auf exakt KEINE relevante verkehrspolitische Frage eine Antwort hat, dass sie sich mit einer solchen Kampagne so zur Lachnummer macht? Tempolimit CSU;Tempolimit;negative
Oliver_Krischer15891383071;Das System Billigfleisch beruht auf Ausbeutung von Mensch und Tier und Umweltzerstoerung. Es schockiert, dass ausgebeutete Arbeiter nicht einmal vor dem coronavirus von Behoerden und Unternehmen wie Westfleisch geschuetzt werden. Wann machen wir endlich Schluss mit Billigfleisch?;Billigfleisch;negative
Oliver_Krischer16052160551;Immer wieder unglaublich: Die Bundesregierung FOeRDERT mit Mrd. Euro die ZERSTOeRUNG von Klima Umwelt. aendern daran seit Jahren nichts, allen Klimaschutz Reden zum Trotz. Dabei ist das oft auch noch, wie das Dienstwagenprivileg, schreiend sozial ungerecht.;Klimaschutz;negative
PeterFelser15888312131;Wer Demokratie, Grundrechte seine Freiheit vor dem Zugriff von Regierungsbehoerden Konzernen schuetzen moechte, ist fuer die GEZ-Medien ein Spinner. Als Referenz dienen mittlerweile Hollywood-Millionaere. Die Staatsjournalisten sind scheinbar voellig durchgeknallt! AfD Corona;GEZ-Medien;negative
