doc_id;full_text;topic;label
KaiGehring16099352841;4/10 Mit dem Kurs der Bundesregierung schlittern wir eine verschaerfte Bildungsspaltung, die uns als Gesellschaft in den naechsten Jahren teuer zu stehen kommt. Die Schulen aechtzen unter dem Druck. Warum z.B. gibt es immer noch kein Bundes-Programm fuer Luftfilter an Schulen?;Schulen;negative
Kaiser_SPD15346111721;Was fuer ein Fest! Das Familienfest der spdthueringen, der SPD-Fraktion im Thueringer Landtag und der SPD Gera war ein voller Erfolg! Gute Stimmung, tolle Gaeste und interessante;Familienfest;positive
Kaiser_SPD15726233031;Wieder einmal beweist dieser Mann, dass er seines Mandates nicht wuerdig ist. Antisemitismus und Verschwoerungstheorien haben im Parlament nichts zu suchen: Brandner nennt Bundesverdienstkreuz an Lindenberg Judaslohn;Brandner;negative
Kaiser_SPD15931864311;Gera erneut erfolgreich! Der Bund foerdert das Tietz-Quartier auf der Sorge mit sensationellen 5,8 Mio. Euro! Ich als Mitglied der Fachjury fuer dieses Bundesprogramm bin sehr stolz, dass wir das geschafft haben.;Gera;positive
Kaiser_SPD15994724411;Toller Start fuer die Bundestagswahl 2021! Danke fuer das Vertrauen! Am 5. September hat mir mein Kreisverband einstimmig und mit viel Zuspruch das Vertrauen ausgesprochen, fuer Gera als Bundestagskandidatin im;Bundestagskandidatin;positive
KarambaDiaby15905748711;icantbreathe - Es sind entsetzliche Bilder, die uns aus den USA erreichen. Ein Schwarzer Mensch ist gestorben, weil ihn ein weisser Polizist mit dem Knie die Luft abdrueckte. Immer wieder kommt es zur Polizeigewalt gegen Schwarze Menschen. Das muss endlich aufhoeren. George Floyd;Schwarze;negative
KartesMdB15292080001;Heute steht zum ersten Mal waehrend der WM2018 unsere Elf auf dem Rasen! Wir sind stolz auf Die Mannschaft und freuen uns auf mitreissende Spiele. Uns allen wuensche ich viel Spass beim Zuschauen, Tippen und Mitfiebern! Auf gehts Jungs, viel Erfolg! Koenig Fussball Ger Mex;WM2018;positive
KartesMdB15340802701;Kampfgeist und Leidenschaft hatten heute alle fuenf Mannschaften beim Human Table Soccer Turnier der cdulumaudach . Die CDU Niederfeld konnte als Gewinnerteam den Pokal nach Hause bringen. Herzlichen Glueckwunsch! soccerturnier tolle Mannschaften Kartesauf Sommertour;Soccer;positive
KatjaKeul15259565141;Spannender Austausch mit Max Weber von und Alexander Schudy von Eine Welt Stadt Berlin ueber konkrete Handlungsmoeglichkeiten in Sachen Ruestungsexporte. Schoene Location und gute Gespraechsatmosphaere! Abruestung Frieden;Austausch;positive
KatjaKeul15613541831;Iran-Krise: Es ist erschreckend wie hilflos 28 EU Staaten angesichts ungerechtfertigter US-Sanktionen dastehen. Im Sinne unseres eigenen Sicherheitsinteresses sollten wir daran arbeiten das zu aendern.;Iran-Krise;negative
KatjaKeul15617025281;Die Situation im Iran ist ein Fiasko. Versorgung mit Hilfsguetern ist quasi unmoeglich und internationale Banken sind maximal verunsichert. Hoechste Zeit, INSTEX in Gang zu bringen! (/tk);Iran;negative
KatjaKeul15683654511;Grosses Dankeschoen an von Er hat beim Gruendungstreffen zum Parlamentskreis Atomwaffenverbot deutlich gemacht, wie enorm wichtig unsere Unterstuetzung aus dem Bundestag fuer das Anliegen ist.;Atomwaffenverbot;positive
KatjaKeul15768450161;Unfassbar! Seit Kuendigung des Iran Deals im Sommer 2018 wurde noch keine einzige Transaktion ueber INSTEX abgewickelt! Die EU muss hier entschlossener vorgehen, wenn sie jemals ihre Souveraenitaet gegen US Sanktionen verteidigen will.;Iran;negative
KatjaMast15189720441;Super Basiskonferenzen zum Mitgliederentscheid in Mainz. Phantastisch wie viele engagierte Teilnehmer tolle Ideen zu SPDerneuern und einer moeglichen Regierungsbeteiligung hatten . So koennen wir Gemeinsam Was Bewegen! Groko;Mitgliederentscheid;positive
KatjaMast15395296741;ltwBY18 ist ein Paukenschlag. Die CSU ist fuer ihren Rechtsruck und ihren Krawall in der Groko abgestraft worden. Fuer die ist das Ergebnis bitter. Da gibt es nichts zu beschoenigen. Wir haben es in Bayern nicht geschafft, mit unseren Themen Durchschlagskraft zu erreichen.;ltwBY18;negative
KatjaMast15489465091;Super: in Brandenburg wurde heute Deutschlands erstes Paritaetsgesetz beschlossen! In Zukunft heisst es, die Haelfte der Macht fuer Frauen. Ein gutes Signal fuer die Bundesebene! Paritaet ist moeglich - in Frankreich uebrigens schon seit 2001.;Paritaetsgesetz;positive
KatjaMast15509076761;Der 23.02. ist ein Tag des Gedenkens an die dunkelsten Stunden in Pforzheim. Faschisten haben diesen Vernichtungskrieg verursacht. Es macht mich wuetend, dass Nazis heute das Gedenken missbrauchen. Lasst uns deshalb auch Flagge zeigen gegen Hass, Hetze und Gewalt. Nie Wieder;Faschisten;negative
KatjaMast15621237341;Der 3. Juli ist fuer uns von der Tagdes Mindestlohns, denn heute vor fuenf Jahren hat der Bundestag ihn beschlossen. Der gesetzliche Mindestlohn ist eine historische Leistung. Er hat jeder Kritik Stand gehalten. Er hat keine Arbeitsplaetze gekostet. (1/3);Mindestlohn;positive
KatjaMast15669709381;Mehr Frauen sind in Normalarbeit! Gute Nachricht - nur so koennen eigene Ansprueche in Sozialversicherungen fuer gute Rente erworben werden. Dafuer haben wir auch Brueckenteilzeit + Rueckkehrrecht eingefuehrt. Was noch fehlt: gleiche Bezahlung fuer gleiche Arbeit!;Frauen;positive
KatjaMast15716404241;Glueckwunsch zum 70., Ohne Gewerkschaften waeren wir nicht dort, wo wir heute sind. Der DGB hat unser Land gepraegt: sozial-, arbeitsmarktpolitisch weit darueber hinaus. Und er wird auch weiterhin gebraucht! dgb70;DGB;positive
KatjaMast15815898451;Der Mindestlohn hat unser Land positiv veraendert! Seine Einfuehrung war ein sozialpolitischer Meilenstein hat vIelen zu besseren Loehnen verholfen. Perspektivisch ist fuer mich aber klar: der Mindestlohn muss auf mindestens 12 steigen!;Mindestlohn;positive
KatjaMast15916316091;Kunzmann sollte sich schaemen. Er ist nicht tragbar. Solche Aeusserungen passen weder zu Baden-Wuerttemberg, noch zu Deutschland. Sie sind einfach nur unwuerdig!;Kunzmann;negative
KatjaMast15931690331;Das ist Politikversagen in gruen-schwarz! Die Landesregierung ist nicht in der Lage, wirksam gegen das Geschaeftsmodell in der Fleischindustrie vorzugehen, das mit dem Infektionsgeschehen zusammenhaengt. Im Bund werden werden wir schaerfere Gesetze umsetzen!;Landesregierung;negative
KatjaMast16006729831;Eine absolut zynische Aussage von Friedrich Merz. Viele Menschen machen sich Sorgen um ihre Arbeit... Kurzarbeit sichert in der Corona-Krise Beschaeftigung. Und das fuer sehr viele Menschen ihre Familien.;Merz;negative
KatjaMast16020797681;Kurzes Treffen von SPD-Frauen mit Swetlana Tichanowskaja vor dem Reichstag. Beeindruckende Frau Vorkaempferin fuer demokratischen Wandel in Belarus. Ich habe groessten Respekt vor den unzaehligen DemonstrantInnen. Sie verdienen unsere Unterstuetzung.;Tichanowskaja;positive
KatjaMast16055428171;Wie Querdenken und Co. gezielt versuchen Kinder, ihre Beduerfnisse u. ihre Gesundheit fuer ihre Zwecke zu instrumentalisieren macht mich fassungslos... In diesem Fall ist es ausserdem eine ungeheure Verharmlosung der Verbrechen Nazi-Deutschlands. Via;Querdenken;negative
KatjaMast16070725201;Stahlknecht u. die sind sich der Tragweite ihrer Handlungen entweder nicht bewusst oder auf dem Weg zur wie auch immer gearteten Zusammenarbeit mit der AfD. Beides ist fatal, Letzteres mehr als ein Tabubruch. Und der CDU fehlt die Kraft Einfluss zu nehmen.;AfD;negative
KatrinHelling15621673801;Ich begruesse die Grundsatzentscheidung des zur Sterbebegleitung. Das Urteil gibt Rueckenwind fuer die von der geforderte Liberalisierung der Sterbehilfe. Mein ausfuehrliches Statement bei Facebook:;Sterbebegleitung;positive
KatrinHelling15629239931;Die Antworten der Bundesregierung auf meine kleine Anfrage zu den massiven Umsetzungsproblemen bei der Medizinprodukteverordnung sind unbefriedigend. Entschiedenes Handeln, nicht laue Appelle ist jetzt gefragt! Mein ausfuehrliches Statement bei Facebook:;Medizinprodukteverordnung;negative
KatrinHelling16077780001;Dt. Familienrecht haelt an veralteten Vorstellungen zu Unterhalt u. Kinderbetreuung fest mit ungerechten Ergebnissen u. zum Nachteil des Kindeswohls. Statt Reformen verzoegert die GroKo nur u. verschwendet Steuergeld. Hier meine Rede dazu: Wechselmodell;Familienrecht;negative
KerstinGriese15524240331;Toller Abend bei der mit der besten Nachricht der Woche: endlich konnte sich die durchsetzen, dass die Wahlrechtsausschluesse von Menschen unter vollstaendiger Betreuung abgeschafft werden. Das inklusive Wahlrecht kommt!;Wahlrechtsausschluesse;positive
KerstinGriese15616313351;Am donnerstagderdemokratie danke ich allen ehrenamtlich Engagierten, die sich in Vereinen, Verbaenden und Kirchen fuer gesellschaftlichen Zusammenhalt einsetzen und gegen Hass und Hetze aufstehen. Sie alle sind wahre Alltagshelden! Danke an fuer die Initiative!;ehrenamtlich;positive
KerstinGriese15992097591;Der Inklusionspreis fuer die Wirtschaft 2020 ist digital vergeben worden. Interessante und begeisternde Beispiele, die zeigen: Inklusion im Arbeitsleben ist machbar. Und ein Gewinn fuer alle!;Inklusionspreis;positive
KirstenKappert15397984601;Bestes Timing. Heute hat kanada cannabis legalisiert. Heute habe ich diese Kanadier im getroffen. Congratulation - promise kept! Hopefully Germany will follow soon - fuer Jugend- und Gesundheitsschutz.;cannabis;positive
KirstenKappert15998158391;Seehofer redet im Bundestag von Naechstenliebe und ueberlaesst im selben Atemzug Menschen in Not sich selbst. Das Mindeste waere es, endlich den Kommunen die Aufnahme zu ermoeglichen! Moria Wir Haben Platz;Moria;negative
KonstantinNotz15550776431;Eine wirklich haarstraeubende Antwort des auf meine Frage zu Amazon Alexa Das Ministerium macht sich einen extrem schlanken Fuss und laesst Nutzer Aufsichtsbehoerden im Regen stehen. Gestaltung des digitalen Wandels? Fehlanzeige!;Alexa;negative
KonstantinNotz15639092031;Das demagogische Hetzen gegen bestimmte Menschengruppen wegen ihrer ethnischen oder religioesen Zugehoerigkeit ist schlichter Rassismus. Dieser Rassimus ist widerlich, geschichtsvergessen und inzwischen ein massives Problem fuer die Inneren Sicherheit in Deutschland Waechtersbach;Rassismus;negative
KonstantinNotz15645111301;Die erschuetternde Tat von Frankfurt mit der Fluechtlingskrise 2015 zu verknuepfen, um Profit daraus zu schlagen, ist offenkundig abwegig und politisch einfach maximal widerlich - hat aber bei der AfD offensichtlich System.;AfD;negative
KonstantinNotz15835925671;Liebe Die in Teilen der Partei Die Linke zum Ausdruck gebrachte Parlamentsverachtung ist geschichtsvergessen und schwer ertraeglich. Die Indifferenz zur Menschenrechtssituation in Venezuela, Kuba, etc. - voellig indiskutabel.;Linke;negative
KonstantinNotz15840228841;Fuer Nationalisten + voelkische Ideologen sind Probleme immer extern bedingt,von Menschen,Laendern,Staaten,die sich fernab der eigenen Grenzen befinden oder von dort kommen.Diese menschenfeindlichen Verschwoerungstheorien sind in Zeiten von Corona toedlich,weil falsch und irrefuehrend;Nationalisten;negative
KonstantinNotz15856429421;Es ist ungeheuerlich und irritierend wie verdichtet die Erkenntnis- und Hinweislage bzgl der Gefaehrlichkeit von Stephan E.und Markus H. vor dem Mord an Walter Luebcke war Kassel;Luebcke;negative
KonstantinNotz15878966321;Unterirdisch, dass wir noch Debatten fuehren, bei denen so getan wird, als seien Daten- Privatssphaerenschutz Wohlfuehl-Features und nicht alles entscheidende Freiheitsrechte, die entscheiden, ob Instrument rechtsstaatlich ist oder nicht. Corona App;Privatssphaerenschutz;negative
KonstantinNotz15916955351;Warum die FDP ausgerechnet in diesen Zeiten - in denen es Qualitaet im Journalismus und bei Informationen dringender denn je braucht - mit der AfD im Duett das populististische Liedchen gegen den OeffenlichRechtlichen Rundfunk singen will, ist mir gaenzlich unverstaendlich.;FDP;negative
KonstantinNotz15949696311;Bei der Verfassungswidrigkeit von Sicherheitsgesetzen geht es lang schon nicht mehr um Einzelfaelle Die Ignoranz der Gro Ko gegenueber den Freiheitsrechten im Digitalen Zeitalter ist strukturell. Bestandsdaten;Sicherheitsgesetzen;negative
KonstantinNotz15986919841;Die Reformplaene von CDU SPD und CSU zum Wahlrecht sind so dysfunktional, dass der Deutsche Bundestag bei der BTW2021 wahrscheinlich nicht wieder kleiner, sondern noch groesser wird. Es ist ein demokratischer Frontalunfall mit Vorsatz der Groko;Wahlrecht;negative
KonstantinNotz16008546751;Der bisher geringe Nutzen der Covid19-App ist aeusserst bedauerlich. Die Bundesregierung muss lange bekannte Defizite, auch mit Blick auf steigende Fallzahlen, schnellstmoeglich abstellen. Mein Statement zur 100-Tage-Bilanz gegenueber;Covid19-App;negative
LangeMdB15691414111;Kunst Kultur im laendlichen Raum: gerade bei der Eroeffnung der Ausstellung Formen und Farben im Buergerhaus Unterweissach gewesen. Tolle Ausstellung, anregende Gespraeche;Kultur;positive
LeniBreymaier15547938211;In den 60ern wurden Autos mit sich halbnackt raekelnden Frauen beworben. Das gleiche Niveau erreicht jetzt der Verkehrsminister mit den Radhelmen. Scheuer hat die gesellschaftlichen Entwicklung der letzten 50 Jahre verpasst. Leider.;Scheuer;negative
LeniBreymaier15737342411;Nein, AKK, das Rentensystem stoesst nicht an die Grenze des Machbaren. Ihre Versuche, sich auf Kosten von unterschiedlichen Bevoelkerungsgruppen -heute sind es die Rentnerinnen und Rentner- zu profilieren, sind einfach nur peinlich.;AKK;negative
LeniBreymaier15790961211;Was fuer eine barbarische und feige Art der politischen Auseinandersetzung. Volle Solidaritaet mit meinem Kollegen und seinem Team, auf deren Wahlkreisbuero in Halle 5 Schuesse abgegeben wurden. Die geistigen Schuetzen sitzen auch in den Parlamenten.;Halle;negative
LieblingXhain15848112221;In Wirklichkeit verkriechen sich Kalbitz und Hoecke in den Schoss von Weidel um mit der Strategie der Selbstverharmlosung ihren Rechtsextremismus zu betreiben.Wer soll bei der krassen Bedrohung, die derzeit von rechtem Terror ausgeht, auf solche durchsichtigen Tricks reinfallen;Rechtsextremismus;negative
LisaPaus15571492691;Was ist eigentlich aus den Ankaeufen der Steuer CDs in NRW geworden? Nichts... Unter der neuen Regierung von CDU FDP wird die Jagd auf die Steuerhinterzieher langsam aber sicher beerdigt.;Steuerhinterzieher;negative
LisaPaus15665553671;Gerechtigkeit sollThema d. G7 Gipfels in Biarritz sein. Aber die Ungleichheit nimmt weltweit zu. Und sagt klar: Das liegt an ungerechten Steuersystemen und Deutschland spielt hier seit Jahren ein doppeltes Spiel. Das kann ich leider nur bestaetigen.;Steuersystemen;negative
LisaPaus15766593821;Weitere Einschraenkungen beim IFG sind der voellig falsche Weg! Oeffentlichkeit Bundestag haben ein Recht darauf auch unbequeme Wahrheiten zu erfahren. Cum Ex-Anklagen waeren ohne Aufarbeitung des Bundestages oeffentlichen Druck nicht denkbar gewesen;IFG;negative
LisaPaus15895260141;Ein guter Tag fuer die Gleichberechtigung Erstmals sind Frauen nicht mehr in der Minderheit im Bundesverfassungsgericht. Auf Vorschlag folgt Astrid Wallrabenstein.;Gleichberechtigung;positive
LisaPaus15928166561;Clearstream ist die Spinne im Netz des groessten Steuerraubs der Geschichte Cum Ex. Die BaFin fuehlt sich dafuer nicht zustaendig. Das ist exemplarisch fuer das Versagen dieser Finanzaufsicht und des Bundesfinanzministeriums.;Clearstream;negative
LisaPaus15936850161;125 Mrd. Transaktionen Dax-Unternehmen und keiner fuehlt sich fuer die Geldwaesche-Aufsicht zustaendig?!? Das sind nicht Luecken, dass sind KRATER bei der Wirecard Aufsicht Das allein ist schon ein Skandal...;Wirecard;negative
LisaPaus16041532811;Der Rettungsplan fuer Veranstalter und Soloselbststaendige steht jetzt auf meiner Webseite. Die Koalition hat 8 Monate lang nichts praktikables vorgelegt. Es bleibt nicht mehr viel Zeit, um eine riesige Pleite- und Selbstmordwelle zu verhindern.;Rettungsplan;negative
LisaPaus16045705141;Persoenlich halte ich Vermoegensabgabe fuer sehr zielgerichtet effizient zur Beteiligung der Krisen-Profiteure an einen fairen Lastenausgleich: Vermoegens muss nur einmalig bewertet werden Belastung kann flexibel nach Hoehe Rueckzahlungszeitraum angepasst werden.;Vermoegensabgabe;positive
MGrosseBroemer16081425321;AfD wie immer unzuverlaessig und meldet Austritt einen MdB aus der Fraktion fast einen Monat zu spaet, verstoesst massiv gegen parlamentarische Regeln und nimmt dadurch einen Sitz im Verteidigungsausschuss ueber drei Wochen zu Unrecht in Anspruch. keine Alternative chaostruppe;AfD;negative
MWBirkwald16065724531;Wie dumm ist eigentlich die no Af D? Sie will nur 25 der gesetzlichen Rente auf die Grundsicherung im Alter, also das Rentner-Hartz IV, anrechnen. Dazu sagt Dann erhielte man selbst bei 3200 netto Rente noch steuerfinanzierte Grundsicherung. Absurd! AfDBPT20;Af;negative
MaikBeermann15269241871;Das ist ja eigentlich schon der Witz an sich. Wird Horst Seehofer sonst reelmaessig fuer sein Handeln und seine Denke von der kritisiert, wird hier tatsaechlich so getan, als waere der Familiennachzug fuer Gefaehrder eine Idee von Seehofer. Der Komoedienstadl geht also weiter...;Seehofer;negative
MaikBeermann15278352851;Ich finde, die junge Polizistin aus bremen hat sehr mutig und couragiert gehandelt. Dank und Respekt sollten an erster Stelle stehen - sie hat mit ihrem Handeln einem Menschen das Leben gerettet und ihr eigenes aufs Spiel gesetzt Flensburg;Polizistin;positive
MaikBeermann15507820651;Das ist doch nen Witz! Die Chefverhandlerin will von IHREM JA zu Artikel13 Uploadfiler und LSR mit einem Mal nichts mehr wissen? Sie wusste, dass die Netzfreiheit auf dem Spiel steht. Hier war der Widerstand von der und der zu gering!;Uploadfiler;negative
MaikBeermann15833164661;Die schwadroniert ueber ihr nicht vorhandenes Verstaendnis von Demokratie. Es ist eine geheime Wahl! Es wird von der weder eine Stimme fuer Faschisten noch eine fuer Woelfe im Schafspelz geben! Thueringenwahl Thuerigen;Thueringenwahl;negative
MaikBeermann16042128871;Gut, dass alle drei Kandidaten sich auf einen Kompromiss geeinigt haben. Fair, respektvoll und sachlich muss es jetzt bis Mitte Januar weitergehen. cdupt20 CDUParteitag cdu;CDUParteitag;positive
ManuelHoeferlin15254321691;Datenschutz, Cyber Sec, Netzausbau ... Bei der Digitalisierung gibt es viele Baustellen. Mit der GroKo haben wir zwar kein Ministerium, dafuer aber viele Digitalminister. So wird der Wandel nicht gelingen. Darueber habe ich mit gesprochen:;Digitalisierung;negative
ManuelHoeferlin15543111741;"Gerade beim Cyber-Sicherheitsrat: Gefahr von Angriffen ist allgegenwaertig, aber BReg behandelt ITSicherheit weiter inkonsequent. Gro Ko muss liefern, staerken; echtes Schwachstellenmanagement einfuehren. Resilienz schaffen. Entwurf des IT-SiG 2.0: Bleibe skeptisch!";ITSicherheit;negative
ManuelHoeferlin15717530221;5G ist der bisher mit Abstand sicherste Mobilfunkstandard. Doch fuer Innenminister und Kanzlerin ist dies vor allem ein Hindernis fuer die eigene Agenda. Wieso sie damit die digitale Zukunft des Landes gefaehrden, erklaere ich bei Cyber Security;5G;negative
ManuelHoeferlin16003396781;(4/4) Es ist sowieso skandaloes, dass das BMJV mit einer Salami-Taktik verschiedene Aenderungen am NetzDG in mehrere Gesetze aufteilt, die parallel verhandelt werden. Jetzt faellt ihm selbst auf die Fuesse, was es anfangs vielleicht noch fuer trickreich und clever hielt. Gut so!;NetzDG;negative
ManuelHoeferlin16039838951;ZITi S ist fuer mich eine absolute Blackbox. Eigentlich nur Forschungseinrichtung der Sicherheitsbehoerden. Aber was hat sie schon entwickelt? Bisher konnte oder wollte mir auf meine Anfragen keine Antwort geben. Diese Geheimniskraemerei ist ueberzogen und unnoetig.;ZITi;negative
ManuelSarrazin15517783981;Die Position der polnischen Regierung zur gemeinsamen Asylpolitik der EU ist falsch. Es ist aber auch falsch deswegen Schengen in Frage zu stellen. Die offene Grenze nicht nur zwischen Deutschland und Polen ist unverzichtbar. Macron;Asylpolitik;negative
ManuelSarrazin15571322851;Wo bleiben eigentlich die klaren Worte von zu dieser absoluten Provokation. Putin begraebt das Minsker Abkommen, versucht die Situation in der Ukraine gezielt zu eskalieren und den gewaehlten designierten Praesidenten Zelensky zu schwaechen.;Putin;negative
ManuelSarrazin15636226491;Sprachlos angesichts der grenzenlosen Verschwendung auf Kosten des Staates in der Protzvilla Honka von Ex-Praesident Janukowytsch. Wegen dessen korrupten Regime von Gnaden Putins befindet sich die Ukraine seit 5;Ukraine;negative
ManuelSarrazin15790824341;Jetzt ist eigentlich klar, wer 2024 auf Putin folgt: Putin. Die angekuendigte Verfassungsaenderung ebnet formal moegliche Wege, politisch wird das sicher nicht so einfach. Die Rede gesteht ein: Das Regime Putin ist so schwach, dass es ohne Putin nicht kann. Russland Verfassung;Putin;negative
ManuelSarrazin15850527391;Endlich! Wir brauchen die Eroeffnung der EU-Beitrittsgespraeche . Das war ueberfaellig, das Zoegern hat der EU geschadet. Congratulations to und Enlargement Now: solidarity to fight Covid19 is essential in the Region!;EU-Beitrittsgespraeche;positive
MarcBernhardAfD15307794331;Meine Rede zum Haushalt: Die Kanzlerin der Schmerzen spielt mit ihren Wohnungsbauvorhaben Fluechtlinge gegen die hiesige Bevoelkerung aus! Schon laenger hier Wohnenden wurde sogar schon Wohnraum fuer Fluechtlinge entzogen!;Fluechtlinge;negative
MarcBernhardAfD15415759311;Grenzwert-Ueberschreitung ohne Autos entlarvt Messstellen-Wahnsinn Umweltbundesamt: der Stickstoffdioxid-Gehalt in der Luft ganz ohne Autos liegt knapp unterhalb des EU-Grenzwertes. Jeglicher Strassenverkehr fuehrt so ganz zwangslaeufig zu Fahrverboten! https://t.co/5yJplQlnak;Messstellen-Wahnsinn;negative
MarcBernhardAfD15445411511;Unverantwortlich und skandaloes: Bundesumweltministerin Schulze (SPD) will die Deutsche Umwelthilfe weiterhin finanziell foerdern! Toyota hat angekuendigt, die finanzielle Unterstuetzung der Umwelthilfe nach 20 Jahren einzustellen. Ich fordere: kein Geld mehr fuer die DUH!;Umwelthilfe;negative
MarcBernhardAfD15446315041;Was fuer eine Ueberraschung - jeder dritte Haeftling ist Auslaender. Doppelpass-Haeftlinge werden in der Statistik als Deutsche ausgewiesen. Die tatsaechliche Zahl der Haeftlinge mit Migrationshintergrund ist also noch viel groesser. Ein trauriges Deutschland.;Auslaender;negative
MarcBernhardAfD15517113751;Fridays for Future-Demonstrationen: Bundeskanzlerin Merkel unterstuetzt Schulschwaenzen und lobt politisches Engagement . Aufforderung zum Rechtsbruch und ideologischer Missbrauch von Kindern und Jugendlichen! Politisches Engagement nach dem Unterricht!https://t.co/9GOHq88MkV;Fridays;negative
MarcBernhardAfD15517988711;Ich fordere sofortigen Stopp des Geldsegens fuer dubiose DUH! Gemeinnuetzigkeit des Vereins infrage gestellt,aber 2019bis zu3,5Millionen Euro aus Steuergeldern!Buerger finanzieren Verein,der sich Vernichtung ihres Eigentums auf die Fahnen geschrieben hat!https://t.co/5x2cbmIgo1;DUH;negative
MarcBernhardAfD15566297721;Steuerverschwendung bei Fluechtlingsunterbringung in Berlin. 150 EUR pro Kopf und Nacht! Buerger durch CO2-Steuer noch mehr abgezockt, aber Geld spielt fuer verfehlte Asylpolitik der Bundesregierung keine Rolle! AfD Grenzen schliessen.https://t.co/9GOHq7RaWl;Asylpolitik;negative
MarcBernhardAfD15579254501;Irrsinn:Forderung nach Ausrufung Klimanotstand Karlsruhe! Ziel: Karlsruhe bis 2030 klimaneutral.Forderungen basieren auf gefaehrlicher ideologischer Verblendung mit nicht absehbaren neg.Folgen fuer Wirtschaft und Wohlstand!Jetzt auch Notstand ausrufen?https://t.co/9GOHq88MkV;Klimanotstand;negative
MarcBernhardAfD15615541671;Anonymer Krankenschein fuer Illegale auf Kosten der Steuerzahler ist Einladung zu illegaler Einwanderung und Freibrief fuer Sozialmissbrauch! Irrsinn: Statt Abschiebung abgelehnter Asylbewerber medizinische Rundumversorgung zum Nulltarif!https://t.co/9GOHq88MkV;Einwanderung;negative
MarcBernhardAfD15728828761;Verfassungsschutz mit Stasimethoden: Hinweistelefon ist staatlich gefoerderte Denunziation! Kampf gegen alle Formen von Extremismus und Terrorismus notwendig. Regierung und Verfassungsorgane auf linkem Auge blind! Sozialismus 30jahremauerfall;Hinweistelefon;negative
MarcBernhardAfD15768544771;Klimapaket ist eine der massivsten Steuererhoehungen ueberhaupt Deutsche weiter geschroepft! Nach Kosten fuer sogenannte Energiewende jetzt weitere Mehrbelastung in Form universeller Steuer auf das Leben!;Klimapaket;negative
MarcBernhardAfD15791927211;Luisa Neubauer, die deutsche Greta soll Spitzenposten im Siemens Konzern bekommen und die SPD fuehrt eigennuetzig die Bonpflicht ein. Das Jahr 2020 faengt genauso absurd an, wie das Jahr 2019 mit dem Oma-Umweltsaulied zu Ende ging. Bernhard;Neubauer;negative
MarcBernhardAfD15838533511;Kinder und Kullertraenen als Schutzschild fremder Interessen. GroKo will angebliche Fluechtlingskinder aus Griechenland holen: Anreize fuer Einreisewillige, Kinder auf den Weg nach Europa voraus zu schicken! Deutschland darf sich nicht erpressen lassen! Bernhard;Fluechtlingskinder;negative
MarcBernhardAfD15906439441;Twitter: Merkel, Macron und von der Leyen ueberbieten sich beim Umverteilen deutscher Staatsfinanzen Genschenke- und Schuldenunion wird kontinuierlich vorangetrieben. Diese wahnsinnige Umverteilung fuehrt uns zum naechsten historischen Truemmerhaufen! Bernhard;Schuldenunion;negative
MarcBernhardAfD15911055781;SPD-Vorsitzende Saskia Esken bekennt sich zur Terrorgruppe Antifa, verantwortlich fuer unzaehlige Ausschreitungen und Angriffe auf Sympathisanten, Mitglieder und Abgeordnete der AfD! Politisch motivierte Gewalt gehoert geaechtet und nicht hofiert! Bernhard;Antifa;negative
